[
  {
    "source_product_id": "1010110646",
    "title": "이브 웨지 3",
    "brand": "에이비씨 셀렉트",
    "price": "19,000원",
    "price_original": "49,000원",
    "discount_percent": 61,
    "image_url": "https://image.a-rt.com/art/product/2025/02/03182_1738835298058.jpg?shrink=590:590",
    "images": [
      "https://image.a-rt.com/art/product/2024/03/63574_1711439942433.jpg",
      "https://image.a-rt.com/art/product/2024/03/43822_1711439942586.jpg",
      "https://image.a-rt.com/art/product/2024/03/50715_1711439942732.jpg",
      "https://image.a-rt.com/art/product/2024/03/09250_1711439942882.jpg",
      "https://image.a-rt.com/art/product/2024/03/37433_1711439943045.jpg"
    ],
    "color": "",
    "style_code": "",
    "link": "https://abcmart.a-rt.com/product?prdtNo=1010110646",
    "site": "abcmart",
    "rating": 4.3,
    "review_count": 13,
    "category": "토오픈/슬링백",
    "category_path": "신발 > 구두 > 토오픈/슬링백",
    "in_stock": true,
    "options": {
      "colors": [
        "BLACK"
      ],
      "sizes": [
        "225",
        "230",
        "235",
        "240",
        "245",
        "250"
      ]
    },
    "reviews": [
      {
        "review_source_id": "3072378",
        "content": "바닥이 푹신푹신해서 발이 아주 편해요\r\n기본템으로 신기에 너무 만족합니다! \r\n",
        "score": 5,
        "date": "2026-07-15",
        "size": "BLACK, 240",
        "helpful_count": 0,
        "images": [
          "https://image.a-rt.com//art/user/photo/202607/1585/69941_1784093873949.jpg"
        ],
        "detail_scores": {
          "착화감": 2,
          "가격": 2,
          "디자인": 2,
          "내구성": 2,
          "경량성": 2
        },
        "review_color": "BLACK",
        "is_best": false,
        "user_size": null,
        "partner_comment": null,
        "size_survey": null,
        "is_blind": null
      },
      {
        "review_source_id": "3071708",
        "content": "아니 이가격에 이렇게 편한 신발이라니 너무 감동이네요; ",
        "score": 5,
        "date": "2026-07-14",
        "size": "BLACK, 230",
        "helpful_count": 0,
        "images": [],
        "detail_scores": {
          "착화감": 3,
          "가격": 2,
          "디자인": 2,
          "내구성": 2,
          "경량성": 3
        },
        "review_color": "BLACK",
        "is_best": false,
        "user_size": null,
        "partner_comment": null,
        "size_survey": null,
        "is_blind": null
      },
      {
        "review_source_id": "3068288",
        "content": "사진과 동일하고 굽 낮은거 찾고 있었는데 좋아요",
        "score": 3,
        "date": "2026-07-08",
        "size": "BLACK, 230",
        "helpful_count": 0,
        "images": [
          "https://image.a-rt.com//art/user/photo/202607/1722/43843_1783480062306.jpeg"
        ],
        "detail_scores": {
          "착화감": 2,
          "가격": 2,
          "디자인": 2,
          "내구성": 2,
          "경량성": 2
        },
        "review_color": "BLACK",
        "is_best": false,
        "user_size": null,
        "partner_comment": null,
        "size_survey": null,
        "is_blind": null
      }
    ]
  },
  {
    "source_product_id": "1010103543",
    "title": "픽시스 4",
    "brand": "누오보",
    "price": "19,000원",
    "price_original": "59,000원",
    "discount_percent": 67,
    "image_url": "https://image.a-rt.com/art/product/2024/03/63574_1711439942433.jpg?shrink=590:590",
    "images": [
      "https://image.a-rt.com/art/product/2024/01/68776_1706588968534.jpg",
      "https://image.a-rt.com/art/product/2024/01/26961_1706588968694.jpg",
      "https://image.a-rt.com/art/product/2024/01/46825_1706588968840.jpg",
      "https://image.a-rt.com/art/product/2024/01/16547_1706588969005.jpg",
      "https://image.a-rt.com/art/product/2024/01/05468_1706588969150.jpg"
    ],
    "color": "",
    "style_code": "",
    "link": "https://abcmart.a-rt.com/product?prdtNo=1010103543",
    "site": "abcmart",
    "rating": 5,
    "review_count": 4,
    "category": "메리제인",
    "category_path": "신발 > 구두 > 메리제인",
    "in_stock": true,
    "options": {
      "colors": [
        "BEIGE"
      ],
      "sizes": [
        "225",
        "230",
        "235",
        "240",
        "245",
        "250"
      ]
    },
    "reviews": [
      {
        "review_source_id": "3065040",
        "content": "검은색 사고 한켤레 더 샀어요 거의 제 사이즈 매진직전 산듯...투웨이방식은 아니라서 샌들로는 못신고요 슬리퍼처럼 신는데 앞에 끈이 두개 있고 앞커버가 긴 모델이라 편하게 신어요. 다만 전 240이 아닌  245샀어요 사무실서 신을려고요. 그래서 발볼이 좀 있는 편인데 245가 잘맞아서 이게 240사이즈일때는 발봅이 좁게나오는건지 정확히는 모르겠네요.",
        "score": 5,
        "date": "2026-06-30",
        "size": "BEIGE, 245",
        "helpful_count": 0,
        "images": [],
        "detail_scores": {
          "착화감": 1,
          "가격": 2,
          "디자인": 1,
          "내구성": 2,
          "경량성": 3
        },
        "review_color": "BEIGE",
        "is_best": false,
        "user_size": null,
        "partner_comment": null,
        "size_survey": null,
        "is_blind": null
      },
      {
        "review_source_id": "2904761",
        "content": "매장에서 직접 신어보고 바로 구매했어요! \r\n너무 예쁘고 발 앞에 있는 부분이 혹시 마찰이 많이 되면 살 까지진 않을까 걱정했는데 까지지 않는 것 같아서 너무 좋습니다!\r\n겨울에 신기엔 좀 추울 것 같고 봄부터 가을까지 신기 좋을 것 같아요~",
        "score": 5,
        "date": "2025-02-16",
        "size": "245",
        "helpful_count": 0,
        "images": [
          "https://image.a-rt.com//art/user/photo/202502/1731/49404_1739730821317.jpeg"
        ],
        "detail_scores": {
          "착화감": 2,
          "가격": 2,
          "디자인": 2,
          "내구성": 2
        },
        "review_color": "BEIGE",
        "is_best": false,
        "user_size": null,
        "partner_comment": null,
        "size_survey": null,
        "is_blind": null
      },
      {
        "review_source_id": "2872025",
        "content": "발볼 넓고  발등 높아서 신발 고르기 넘 어려운데 모처럼 편한 신발 찾았어요!!!",
        "score": 5,
        "date": "2024-10-08",
        "size": "BEIGE, 250",
        "helpful_count": 0,
        "images": [
          "https://image.a-rt.com//art/user/photo/202410/1385/01496_1728426917545.jpg"
        ],
        "detail_scores": {
          "착화감": 2,
          "가격": 2,
          "디자인": 3,
          "내구성": 3
        },
        "review_color": "BEIGE",
        "is_best": false,
        "user_size": null,
        "partner_comment": null,
        "size_survey": null,
        "is_blind": null
      }
    ]
  },
  {
    "source_product_id": "1010103856",
    "title": "빈슨",
    "brand": "스테파노로시",
    "price": "29,000원",
    "price_original": "109,000원",
    "discount_percent": 73,
    "image_url": "https://image.a-rt.com/art/product/2024/05/96117_1717032534661.jpg?shrink=590:590",
    "images": [
      "https://image.a-rt.com/art/product/2024/02/74281_1707984390554.jpg",
      "https://image.a-rt.com/art/product/2024/02/07714_1707984390804.jpg",
      "https://image.a-rt.com/art/product/2024/02/07896_1707984390980.jpg",
      "https://image.a-rt.com/art/product/2024/02/58752_1707984391138.jpg",
      "https://image.a-rt.com/art/product/2024/02/76003_1707984391372.jpg"
    ],
    "color": "",
    "style_code": "",
    "link": "https://abcmart.a-rt.com/product?prdtNo=1010103856",
    "site": "abcmart",
    "rating": 4.7,
    "review_count": 15,
    "category": "웨지",
    "category_path": "신발 > 구두 > 웨지",
    "in_stock": true,
    "options": {
      "colors": [
        "BEIGE"
      ],
      "sizes": [
        "39",
        "40",
        "41",
        "42",
        "43",
        "44",
        "45"
      ]
    },
    "reviews": [
      {
        "review_source_id": "3078569",
        "content": "색상이 완전 베이지라기보단 살짝 카기가 섞인 느낌? 입니다 크게 다르진 않고요 그리고 생각보다 두꺼워서 여름엔 힘들겠네요 가볍진 않습니다",
        "score": 4,
        "date": "2026-07-27",
        "size": "S/SAND, 41",
        "helpful_count": 0,
        "images": [
          "https://image.a-rt.com//art/user/photo/202607/1722/70986_1785149672298.jpeg"
        ],
        "detail_scores": {
          "착화감": 2,
          "가격": 3,
          "디자인": 2,
          "내구성": 1,
          "경량성": 2
        },
        "review_color": "S/SAND",
        "is_best": false,
        "user_size": null,
        "partner_comment": null,
        "size_survey": null,
        "is_blind": null
      },
      {
        "review_source_id": "3077327",
        "content": "아주 저렴하고 가성비 넘치게 전투화 구매하게 되어 정말 기쁘네요 잘 신을게요!!!!!!!!가볍고 발은 편합니다 본인 발볼이 넓고 발등이 매우 높아서 보통 분들은 정사이즈 발볼/등 넓고 높은 분들은 한사이즈 업 해서 사시면 됩니다~~~",
        "score": 5,
        "date": "2026-07-24",
        "size": "S/SAND, 42",
        "helpful_count": 0,
        "images": [
          "https://image.a-rt.com//art/user/photo/202607/1357/14226_1784860311601.jpg"
        ],
        "detail_scores": {
          "착화감": 2,
          "가격": 2,
          "디자인": 1,
          "내구성": 1,
          "경량성": 2
        },
        "review_color": "S/SAND",
        "is_best": false,
        "user_size": null,
        "partner_comment": null,
        "size_survey": null,
        "is_blind": null
      },
      {
        "review_source_id": "3072944",
        "content": "신발사이즈 잘맞고, 배송 빨리 잘 받았습니다.",
        "score": 5,
        "date": "2026-07-16",
        "size": "S/SAND, 42",
        "helpful_count": 0,
        "images": [],
        "detail_scores": {
          "착화감": 2,
          "가격": 3,
          "디자인": 2,
          "내구성": 2,
          "경량성": 3
        },
        "review_color": "S/SAND",
        "is_best": false,
        "user_size": null,
        "partner_comment": null,
        "size_survey": null,
        "is_blind": null
      }
    ]
  },
  {
    "source_product_id": "1010124720",
    "title": "젤 메리제인 1",
    "brand": "에이비씨 셀렉트",
    "price": "29,000원",
    "price_original": "49,000원",
    "discount_percent": 40,
    "image_url": "https://image.a-rt.com/art/product/2026/05/68023_1779067312981.jpg?shrink=590:590",
    "images": [
      "https://image.a-rt.com/art/product/2022/09/57992_1662094806977.jpg",
      "https://image.a-rt.com/art/product/2022/09/79374_1662094807129.jpg",
      "https://image.a-rt.com/art/product/2022/09/21414_1662094807278.jpg",
      "https://image.a-rt.com/art/product/2022/09/48282_1662094807432.jpg",